product_name,category,price,commission_percent,rating,reviews,main_benefit,pain_point,tiktok_angle,stock_status,affiliate_link
เครื่องนวดคอไฟฟ้า,สุขภาพ,399,12,4.7,2580,ช่วยผ่อนคลายคอและบ่า,นั่งทำงานนานแล้วเมื่อย,ลองใช้หลังเลิกงาน 7 วัน,in_stock,https://example.com/product-1
กล่องเก็บสายชาร์จ,ของใช้ในบ้าน,79,8,4.6,5300,โต๊ะทำงานดูเป็นระเบียบ,สายชาร์จรกหาไม่เจอ,จัดโต๊ะ 1 นาทีให้ดูแพงขึ้น,in_stock,https://example.com/product-2
แก้วเก็บความเย็นพกพา,ไลฟ์สไตล์,199,10,4.8,8900,เก็บความเย็นได้นานและพกง่าย,น้ำแข็งละลายเร็วระหว่างวัน,ทดสอบน้ำแข็งตั้งแต่เช้าถึงเย็น,in_stock,https://example.com/product-3
ไฟเซนเซอร์ทางเดิน,ของใช้ในบ้าน,129,9,4.5,2100,เปิดไฟอัตโนมัติตอนเดินผ่าน,ตื่นกลางคืนแล้วมองไม่เห็นทาง,ติดไฟจุดมืดในบ้านแบบไม่ต้องเดินสาย,in_stock,https://example.com/product-4
แปรงทำความสะอาดซอกเล็ก,ทำความสะอาด,59,15,4.4,7400,ช่วยทำความสะอาดร่องและซอกเล็ก,คราบฝังในร่องกระเบื้องหรือขอบอ่าง,ก่อนหลังขัดซอกที่หลายคนมองข้าม,in_stock,https://example.com/product-5

